{
  "$id": "https://hmwh.se/schemas/permansson/application-successor/1/belief_tree.v1.schema.json",
  "$schema": "https://json-schema.org/draft/2020-12/schema",
  "additionalProperties": false,
  "properties": {
    "format": {
      "const": "Permansson.App.FiniteBeliefTreeRequest.v1"
    },
    "horizon": {
      "maximum": 3,
      "minimum": 1,
      "type": "integer"
    },
    "likelihoods": {
      "items": {
        "additionalProperties": false,
        "properties": {
          "weights": {
            "additionalProperties": {
              "maxLength": 160,
              "pattern": "^(?:0|[1-9][0-9]*|-?[1-9][0-9]*)(?:/[1-9][0-9]*)?$",
              "type": "string"
            },
            "maxProperties": 3,
            "minProperties": 1,
            "propertyNames": {
              "pattern": "^[A-Za-z][A-Za-z0-9_-]{0,31}$",
              "type": "string"
            },
            "type": "object"
          },
          "x": {
            "pattern": "^[A-Za-z][A-Za-z0-9_-]{0,31}$",
            "type": "string"
          }
        },
        "required": [
          "x",
          "weights"
        ],
        "type": "object"
      },
      "maxItems": 3,
      "minItems": 1,
      "type": "array"
    },
    "model": {
      "$ref": "https://hmwh.se/schemas/permansson/application-successor/1/finite_world.v1.schema.json"
    },
    "observations": {
      "items": {
        "pattern": "^[A-Za-z][A-Za-z0-9_-]{0,31}$",
        "type": "string"
      },
      "maxItems": 3,
      "minItems": 1,
      "type": "array",
      "uniqueItems": true
    },
    "prior": {
      "items": {
        "additionalProperties": false,
        "properties": {
          "mass": {
            "maxLength": 160,
            "pattern": "^(?:0|[1-9][0-9]*|-?[1-9][0-9]*)(?:/[1-9][0-9]*)?$",
            "type": "string"
          },
          "s": {
            "pattern": "^[A-Za-z][A-Za-z0-9_-]{0,31}$",
            "type": "string"
          },
          "x": {
            "pattern": "^[A-Za-z][A-Za-z0-9_-]{0,31}$",
            "type": "string"
          }
        },
        "required": [
          "s",
          "x",
          "mass"
        ],
        "type": "object"
      },
      "maxItems": 6,
      "minItems": 1,
      "type": "array"
    },
    "terminal_rewards": {
      "items": {
        "additionalProperties": false,
        "properties": {
          "s": {
            "pattern": "^[A-Za-z][A-Za-z0-9_-]{0,31}$",
            "type": "string"
          },
          "value": {
            "maxLength": 160,
            "pattern": "^(?:0|[1-9][0-9]*|-?[1-9][0-9]*)(?:/[1-9][0-9]*)?$",
            "type": "string"
          },
          "x": {
            "pattern": "^[A-Za-z][A-Za-z0-9_-]{0,31}$",
            "type": "string"
          }
        },
        "required": [
          "s",
          "x",
          "value"
        ],
        "type": "object"
      },
      "maxItems": 6,
      "minItems": 1,
      "type": "array"
    }
  },
  "required": [
    "format",
    "model",
    "horizon",
    "prior",
    "observations",
    "likelihoods",
    "terminal_rewards"
  ],
  "type": "object"
}
